{"v":"orch.cli/2.0","ok":true,"data":{"target":"search","name":"search","cli":"orch search","summary":"Search ticket titles and sections.","who":"read","usage":"orch search QUERY [--limit N]","pre":["workspace_exists"],"emits":[],"input":{"type":"object","description":"Search ticket titles and sections.","properties":{"query":{"type":"string","description":"what to look for","x-metavar":"QUERY"},"limit":{"type":"integer","description":"at most this many","minimum":1,"maximum":200,"default":10,"x-metavar":"N"}},"x-positional":["query"],"required":["query"],"additionalProperties":false},"output":{"text":"ok search {count}\nnext: {next}","json":{"type":"object","properties":{"count":{"type":"integer","minimum":0},"hits":{"type":"array","items":{"type":"object","properties":{"key":{"$ref":"https://schemas.orch.dev/v2/common#/$defs/ticketKey"},"where":{"type":"string"},"line":{"type":"string"}},"required":["key","where","line"],"additionalProperties":false}}},"required":["count","hits"],"additionalProperties":false}},"errors":[]},"key":null,"seq":0,"cursor":0,"hints":[]}
