{
  "v": "orch.cli/2.0",
  "ok": true,
  "data": {
    "target": "member.role",
    "name": "member.role",
    "cli": "orch member role",
    "summary": "Change a member's role.",
    "who": "human",
    "usage": "orch member role PERSON owner|maintainer|member|viewer [--dry-run]",
    "pre": [
      "workspace_exists",
      "role_allows",
      "user_presence"
    ],
    "emits": [
      "role.changed"
    ],
    "input": {
      "type": "object",
      "description": "Change a member's role.",
      "properties": {
        "person": {
          "type": "string",
          "description": "person id",
          "pattern": "^p_[0-9a-f]{32}$",
          "x-metavar": "PERSON"
        },
        "role": {
          "type": "string",
          "enum": [
            "owner",
            "maintainer",
            "member",
            "viewer"
          ],
          "description": "role",
          "x-metavar": "ROLE"
        }
      },
      "x-positional": [
        "person",
        "role"
      ],
      "required": [
        "person",
        "role"
      ],
      "additionalProperties": false
    },
    "output": {
      "text": "ok role.changed {person} {role} seq={seq}\nnext: {next}",
      "json": {
        "type": "object",
        "properties": {
          "person": {
            "type": "string"
          },
          "role": {
            "type": "string"
          }
        },
        "required": [
          "person",
          "role"
        ],
        "additionalProperties": false
      }
    },
    "errors": [
      {
        "code": "not_found",
        "exit": 2,
        "retryable": false,
        "hint": "orch list",
        "fix": [
          "orch",
          "list"
        ]
      },
      {
        "code": "custody.no_key",
        "exit": 3,
        "retryable": false,
        "hint": "orch setup sets up your device key",
        "fix": [
          "orch",
          "help"
        ]
      },
      {
        "code": "custody.no_prompt",
        "exit": 3,
        "retryable": false,
        "hint": "run this command yourself, in your own terminal",
        "fix": [
          "orch",
          "help"
        ]
      },
      {
        "code": "custody.wrong_passphrase",
        "exit": 3,
        "retryable": false,
        "hint": "run the command again and type your passphrase",
        "fix": [
          "orch",
          "help"
        ]
      },
      {
        "code": "human_only",
        "exit": 3,
        "retryable": false,
        "hint": "orch ask or orch wait",
        "fix": [
          "orch",
          "describe",
          "ask"
        ]
      },
      {
        "code": "role.denied",
        "exit": 3,
        "retryable": false,
        "hint": "ask an owner or maintainer",
        "fix": [
          "orch",
          "status"
        ]
      },
      {
        "code": "lock.busy",
        "exit": 4,
        "retryable": true,
        "hint": "retry in a moment",
        "fix": [
          "orch",
          "status"
        ]
      },
      {
        "code": "members.stale",
        "exit": 9,
        "retryable": true,
        "hint": "retry; the person re-signs",
        "fix": [
          "orch",
          "status"
        ]
      }
    ]
  },
  "key": null,
  "seq": 0,
  "cursor": 0,
  "hints": []
}
