{
  "v": "orch.cli/2.0",
  "ok": true,
  "data": {
    "target": "task.next",
    "name": "task.next",
    "cli": "orch task next",
    "summary": "The next task to do: its text, what it proves and its verify command.",
    "who": "read",
    "usage": "orch task next [--ref REF]",
    "pre": [
      "ticket_exists",
      "ticket_visible"
    ],
    "emits": [],
    "input": {
      "type": "object",
      "description": "The next task to do: its text, what it proves and its verify command.",
      "properties": {
        "ref": {
          "type": "string",
          "description": "ticket REF (flag); default: your claim",
          "pattern": "^(?:(?:[A-Z][A-Z0-9]{0,15}-)?[0-9]+(?:/T[1-9][0-9]*)?|T[1-9][0-9]*)$",
          "x-metavar": "REF"
        }
      },
      "required": [],
      "additionalProperties": false
    },
    "output": {
      "text": "ok {key} task.next {task}\nnext: {next}",
      "json": {
        "type": "object",
        "properties": {
          "task": {
            "type": "string"
          },
          "text": {
            "type": "string"
          },
          "proves": {
            "type": "array",
            "items": {
              "type": "string"
            }
          },
          "verify": {
            "type": "string"
          }
        },
        "required": [],
        "additionalProperties": false
      }
    },
    "errors": [
      {
        "code": "ambiguous_ref",
        "exit": 2,
        "retryable": false,
        "hint": "name the ticket REF, for example DEMO-0043",
        "fix": [
          "orch",
          "status"
        ]
      },
      {
        "code": "not_found",
        "exit": 2,
        "retryable": false,
        "hint": "orch list",
        "fix": [
          "orch",
          "list"
        ]
      }
    ]
  },
  "key": null,
  "seq": 0,
  "cursor": 0,
  "hints": []
}
