{
  "v": "orch.cli/2.0",
  "ok": true,
  "data": {
    "target": "addon.grant",
    "name": "addon.grant",
    "cli": "orch addon grant",
    "summary": "Grant an addon its capabilities (owner only); also enables it.",
    "who": "human",
    "usage": "orch addon grant NAME [--staged STAGE] [--dry-run]",
    "pre": [
      "workspace_exists",
      "addon_exists",
      "role_allows",
      "user_presence"
    ],
    "emits": [
      "addon.granted"
    ],
    "input": {
      "type": "object",
      "description": "Grant an addon its capabilities (owner only); also enables it.",
      "properties": {
        "name": {
          "type": "string",
          "description": "addon name",
          "x-metavar": "NAME"
        },
        "staged": {
          "type": "string",
          "description": "the stage id that `orch addon install` or `update` made (the package comes from it, not from addons/)",
          "x-metavar": "STAGE",
          "pattern": "^st_[0-9a-f]{32}$"
        }
      },
      "x-positional": [
        "name"
      ],
      "required": [
        "name"
      ],
      "additionalProperties": false
    },
    "output": {
      "text": "ok addon.granted {name} seq={seq}\nnext: {next}",
      "json": {
        "type": "object",
        "properties": {
          "name": {
            "type": "string"
          }
        },
        "required": [
          "name"
        ],
        "additionalProperties": false
      }
    },
    "errors": [
      {
        "code": "not_found",
        "exit": 2,
        "retryable": false,
        "hint": "orch list",
        "fix": [
          "orch",
          "list"
        ]
      },
      {
        "code": "custody.no_key",
        "exit": 3,
        "retryable": false,
        "hint": "orch init sets up your device key",
        "fix": [
          "orch",
          "help"
        ]
      },
      {
        "code": "custody.no_prompt",
        "exit": 3,
        "retryable": false,
        "hint": "run this command yourself, in your own terminal",
        "fix": [
          "orch",
          "help"
        ]
      },
      {
        "code": "custody.wrong_passphrase",
        "exit": 3,
        "retryable": false,
        "hint": "run the command again and type your passphrase",
        "fix": [
          "orch",
          "help"
        ]
      },
      {
        "code": "human_only",
        "exit": 3,
        "retryable": false,
        "hint": "orch ask or orch wait",
        "fix": [
          "orch",
          "describe",
          "ask"
        ]
      },
      {
        "code": "market.manifest_mismatch",
        "exit": 3,
        "retryable": false,
        "hint": "the entry is refused",
        "fix": [
          "orch",
          "market",
          "list"
        ]
      },
      {
        "code": "market.not_installed",
        "exit": 3,
        "retryable": false,
        "hint": "orch addon install ID",
        "fix": [
          "orch",
          "market",
          "list"
        ]
      },
      {
        "code": "market.origin_changed",
        "exit": 3,
        "retryable": false,
        "hint": "orch addon list",
        "fix": [
          "orch",
          "market",
          "list"
        ]
      },
      {
        "code": "market.publisher_key_changed",
        "exit": 3,
        "retryable": false,
        "hint": "orch market trust --replace",
        "fix": [
          "orch",
          "market",
          "list"
        ]
      },
      {
        "code": "market.rollback",
        "exit": 3,
        "retryable": false,
        "hint": "an older index or entry is refused",
        "fix": [
          "orch",
          "market",
          "list"
        ]
      },
      {
        "code": "market.staged_changed",
        "exit": 3,
        "retryable": false,
        "hint": "start again",
        "fix": [
          "orch",
          "market",
          "list"
        ]
      },
      {
        "code": "market.version_reused",
        "exit": 3,
        "retryable": false,
        "hint": "raise the version",
        "fix": [
          "orch",
          "market",
          "list"
        ]
      },
      {
        "code": "role.denied",
        "exit": 3,
        "retryable": false,
        "hint": "ask an owner or maintainer",
        "fix": [
          "orch",
          "status"
        ]
      },
      {
        "code": "lock.busy",
        "exit": 4,
        "retryable": true,
        "hint": "retry in a moment",
        "fix": [
          "orch",
          "status"
        ]
      },
      {
        "code": "members.stale",
        "exit": 9,
        "retryable": true,
        "hint": "retry; the person re-signs",
        "fix": [
          "orch",
          "status"
        ]
      }
    ]
  },
  "key": null,
  "seq": 0,
  "cursor": 0,
  "hints": []
}
