{
  "v": "orch.cli/2.0",
  "ok": true,
  "data": {
    "target": "apply",
    "name": "apply",
    "cli": "orch apply",
    "summary": "Apply a batch of operations atomically, from JSON (--file -).",
    "who": "agent",
    "usage": "orch apply --file PATH [--dry-run]",
    "pre": [
      "ticket_exists",
      "base_rev_tracked",
      "grant_valid",
      "text_clean"
    ],
    "emits": [
      "ticket.updated",
      "log.added",
      "task.started",
      "task.done",
      "task.skipped",
      "task.blocked",
      "task.reopened",
      "artifact.added",
      "artifact.replaced",
      "question.asked"
    ],
    "input": {
      "type": "object",
      "description": "Apply a batch of operations atomically, from JSON (--file -).",
      "properties": {
        "file": {
          "type": "string",
          "description": "read the text from PATH, or - for stdin",
          "x-metavar": "PATH",
          "x-file": true
        }
      },
      "required": [
        "file"
      ],
      "additionalProperties": false
    },
    "output": {
      "text": "ok {key} apply {count} seq={seq}\nnext: {next}",
      "json": {
        "type": "object",
        "properties": {
          "count": {
            "type": "integer",
            "minimum": 0
          },
          "events": {
            "type": "array",
            "items": {
              "type": "string"
            }
          }
        },
        "required": [
          "count",
          "events"
        ],
        "additionalProperties": false
      }
    },
    "errors": [
      {
        "code": "ambiguous_ref",
        "exit": 2,
        "retryable": false,
        "hint": "name the ticket REF, for example DEMO-0043",
        "fix": [
          "orch",
          "status"
        ]
      },
      {
        "code": "not_found",
        "exit": 2,
        "retryable": false,
        "hint": "orch list",
        "fix": [
          "orch",
          "list"
        ]
      },
      {
        "code": "grant.expired",
        "exit": 3,
        "retryable": false,
        "hint": "ask the person for a new grant",
        "fix": [
          "orch",
          "status"
        ]
      },
      {
        "code": "grant.required",
        "exit": 3,
        "retryable": false,
        "hint": "ask the person to run orch grant, then set ORCH_GRANT",
        "fix": [
          "orch",
          "status"
        ]
      },
      {
        "code": "transition.refused",
        "exit": 3,
        "retryable": false,
        "hint": "orch show --section current_state",
        "fix": [
          "orch",
          "show"
        ]
      },
      {
        "code": "claim.required",
        "exit": 4,
        "retryable": false,
        "hint": "orch claim",
        "fix": [
          "orch",
          "claim"
        ]
      },
      {
        "code": "lease.held",
        "exit": 4,
        "retryable": false,
        "hint": "pick another task: orch task next",
        "fix": [
          "orch",
          "task",
          "next"
        ]
      },
      {
        "code": "lock.busy",
        "exit": 4,
        "retryable": true,
        "hint": "retry in a moment",
        "fix": [
          "orch",
          "status"
        ]
      },
      {
        "code": "parse.json",
        "exit": 6,
        "retryable": false,
        "hint": "orch describe apply",
        "fix": [
          "orch",
          "describe",
          "apply"
        ]
      },
      {
        "code": "parse.text",
        "exit": 6,
        "retryable": false,
        "hint": "orch describe apply",
        "fix": [
          "orch",
          "describe",
          "apply"
        ]
      },
      {
        "code": "conflict.field",
        "exit": 8,
        "retryable": true,
        "hint": "orch show, then redo the edit",
        "fix": [
          "orch",
          "show"
        ]
      },
      {
        "code": "conflict.section",
        "exit": 8,
        "retryable": true,
        "hint": "orch show --section SECTION, then redo the edit",
        "fix": [
          "orch",
          "show"
        ]
      }
    ]
  },
  "key": null,
  "seq": 0,
  "cursor": 0,
  "hints": []
}
