{
  "v": "orch.cli/2.0",
  "ok": true,
  "data": {
    "target": "release",
    "name": "release",
    "cli": "orch release",
    "summary": "Release your claim without a handoff.",
    "who": "agent",
    "usage": "orch release [REF] [--dry-run]",
    "pre": [
      "ticket_exists",
      "session_holds_claim",
      "grant_valid"
    ],
    "emits": [
      "claim.released"
    ],
    "input": {
      "type": "object",
      "description": "Release your claim without a handoff.",
      "properties": {
        "ref": {
          "type": "string",
          "description": "ticket REF (DEMO-0043, 43); default: your claim",
          "pattern": "^(?:(?:[A-Z][A-Z0-9]{0,15}-)?[0-9]+(?:/T[1-9][0-9]*)?|T[1-9][0-9]*)$",
          "x-metavar": "REF"
        }
      },
      "x-positional": [
        "ref"
      ],
      "required": [],
      "additionalProperties": false
    },
    "output": {
      "text": "ok {key} claim.released released seq={seq}\nnext: {next}",
      "json": {
        "type": "object",
        "properties": {
          "released": {
            "type": "boolean"
          }
        },
        "required": [
          "released"
        ],
        "additionalProperties": false
      }
    },
    "errors": [
      {
        "code": "ambiguous_ref",
        "exit": 2,
        "retryable": false,
        "hint": "name the ticket REF, for example DEMO-0043",
        "fix": [
          "orch",
          "status"
        ]
      },
      {
        "code": "not_found",
        "exit": 2,
        "retryable": false,
        "hint": "orch list",
        "fix": [
          "orch",
          "list"
        ]
      },
      {
        "code": "grant.expired",
        "exit": 3,
        "retryable": false,
        "hint": "ask the person for a new grant",
        "fix": [
          "orch",
          "status"
        ]
      },
      {
        "code": "grant.required",
        "exit": 3,
        "retryable": false,
        "hint": "ask the person to run orch grant, then set ORCH_GRANT",
        "fix": [
          "orch",
          "status"
        ]
      },
      {
        "code": "claim.not_live",
        "exit": 4,
        "retryable": false,
        "hint": "orch status",
        "fix": [
          "orch",
          "status"
        ]
      },
      {
        "code": "claim.required",
        "exit": 4,
        "retryable": false,
        "hint": "orch claim",
        "fix": [
          "orch",
          "claim"
        ]
      },
      {
        "code": "lock.busy",
        "exit": 4,
        "retryable": true,
        "hint": "retry in a moment",
        "fix": [
          "orch",
          "status"
        ]
      }
    ]
  },
  "key": null,
  "seq": 0,
  "cursor": 0,
  "hints": []
}
