{
  "v": "orch.cli/2.0",
  "ok": true,
  "data": {
    "target": "task.block",
    "name": "task.block",
    "cli": "orch task block",
    "summary": "Mark a task blocked, with a reason.",
    "who": "agent",
    "usage": "orch task block TASK --reason TEXT [--dry-run]",
    "pre": [
      "ticket_exists",
      "session_holds_claim",
      "task_exists",
      "session_holds_lease",
      "grant_valid",
      "text_clean"
    ],
    "emits": [
      "task.blocked"
    ],
    "input": {
      "type": "object",
      "description": "Mark a task blocked, with a reason.",
      "properties": {
        "task": {
          "type": "string",
          "description": "task id (T3 or DEMO-0043/T3)",
          "pattern": "^(?:(?:[A-Z][A-Z0-9]{0,15}-)?[0-9]+/)?T[1-9][0-9]*$",
          "x-metavar": "TASK"
        },
        "reason": {
          "type": "string",
          "description": "why",
          "x-metavar": "TEXT"
        }
      },
      "x-positional": [
        "task"
      ],
      "required": [
        "task",
        "reason"
      ],
      "additionalProperties": false
    },
    "output": {
      "text": "ok {key} task.blocked {task} seq={seq}\nnext: {next}",
      "json": {
        "type": "object",
        "properties": {
          "task": {
            "type": "string"
          }
        },
        "required": [
          "task"
        ],
        "additionalProperties": false
      }
    },
    "errors": [
      {
        "code": "ambiguous_ref",
        "exit": 2,
        "retryable": false,
        "hint": "name the ticket REF, for example DEMO-0043",
        "fix": [
          "orch",
          "status"
        ]
      },
      {
        "code": "not_found",
        "exit": 2,
        "retryable": false,
        "hint": "orch list",
        "fix": [
          "orch",
          "list"
        ]
      },
      {
        "code": "grant.expired",
        "exit": 3,
        "retryable": false,
        "hint": "ask the person for a new grant",
        "fix": [
          "orch",
          "status"
        ]
      },
      {
        "code": "grant.required",
        "exit": 3,
        "retryable": false,
        "hint": "ask the person to run orch grant, then set ORCH_GRANT",
        "fix": [
          "orch",
          "status"
        ]
      },
      {
        "code": "transition.refused",
        "exit": 3,
        "retryable": false,
        "hint": "orch show --section current_state",
        "fix": [
          "orch",
          "show"
        ]
      },
      {
        "code": "claim.required",
        "exit": 4,
        "retryable": false,
        "hint": "orch claim",
        "fix": [
          "orch",
          "claim"
        ]
      },
      {
        "code": "lease.held",
        "exit": 4,
        "retryable": false,
        "hint": "pick another task: orch task next",
        "fix": [
          "orch",
          "task",
          "next"
        ]
      },
      {
        "code": "lease.required",
        "exit": 4,
        "retryable": false,
        "hint": "orch task start TASK",
        "fix": [
          "orch",
          "describe",
          "task.start"
        ]
      },
      {
        "code": "lock.busy",
        "exit": 4,
        "retryable": true,
        "hint": "retry in a moment",
        "fix": [
          "orch",
          "status"
        ]
      }
    ]
  },
  "key": null,
  "seq": 0,
  "cursor": 0,
  "hints": []
}
