{
  "v": "orch.cli/2.0",
  "ok": true,
  "data": {
    "target": "addon.enable",
    "name": "addon.enable",
    "cli": "orch addon enable",
    "summary": "Turn on an installed addon that is Off (owner only); it gets the permissions you approved at install.",
    "who": "human",
    "usage": "orch addon enable NAME [--dry-run]",
    "pre": [
      "workspace_exists",
      "addon_exists",
      "role_allows",
      "user_presence"
    ],
    "emits": [
      "addon.enabled"
    ],
    "input": {
      "type": "object",
      "description": "Turn on an installed addon that is Off (owner only); it gets the permissions you approved at install.",
      "properties": {
        "name": {
          "type": "string",
          "description": "addon name",
          "x-metavar": "NAME"
        }
      },
      "x-positional": [
        "name"
      ],
      "required": [
        "name"
      ],
      "additionalProperties": false
    },
    "output": {
      "text": "ok addon.enabled {name} seq={seq}\nnext: {next}",
      "json": {
        "type": "object",
        "properties": {
          "name": {
            "type": "string"
          }
        },
        "required": [
          "name"
        ],
        "additionalProperties": false
      }
    },
    "errors": [
      {
        "code": "not_found",
        "exit": 2,
        "retryable": false,
        "hint": "orch list",
        "fix": [
          "orch",
          "list"
        ]
      },
      {
        "code": "custody.no_key",
        "exit": 3,
        "retryable": false,
        "hint": "orch setup sets up your device key",
        "fix": [
          "orch",
          "help"
        ]
      },
      {
        "code": "custody.no_prompt",
        "exit": 3,
        "retryable": false,
        "hint": "run this command yourself, in your own terminal",
        "fix": [
          "orch",
          "help"
        ]
      },
      {
        "code": "custody.wrong_passphrase",
        "exit": 3,
        "retryable": false,
        "hint": "run the command again and type your passphrase",
        "fix": [
          "orch",
          "help"
        ]
      },
      {
        "code": "human_only",
        "exit": 3,
        "retryable": false,
        "hint": "orch ask or orch wait",
        "fix": [
          "orch",
          "describe",
          "ask"
        ]
      },
      {
        "code": "role.denied",
        "exit": 3,
        "retryable": false,
        "hint": "ask an owner or maintainer",
        "fix": [
          "orch",
          "status"
        ]
      },
      {
        "code": "lock.busy",
        "exit": 4,
        "retryable": true,
        "hint": "retry in a moment",
        "fix": [
          "orch",
          "status"
        ]
      },
      {
        "code": "members.stale",
        "exit": 9,
        "retryable": true,
        "hint": "retry; the person re-signs",
        "fix": [
          "orch",
          "status"
        ]
      }
    ]
  },
  "key": null,
  "seq": 0,
  "cursor": 0,
  "hints": []
}
