{
  "v": "orch.cli/2.0",
  "ok": true,
  "data": {
    "topic": "ask",
    "steps": [
      {
        "op": "ask",
        "call": "orch ask 'question' --option 'a | Title | text' --option 'b | Title | text' --rec a"
      },
      {
        "op": "wait",
        "call": "orch wait"
      }
    ]
  },
  "key": null,
  "seq": 0,
  "cursor": 0,
  "hints": [
    "orch describe CMD"
  ]
}
