{
  "v": "orch.cli/2.0",
  "ok": true,
  "data": {
    "target": "ac.add",
    "name": "ac.add",
    "cli": "orch ac add",
    "summary": "Add an acceptance criterion.",
    "who": "agent",
    "usage": "orch ac add TEXT [--ref REF] [--dry-run]",
    "pre": [
      "ticket_exists",
      "ticket_open_for_work",
      "base_rev_tracked",
      "grant_valid",
      "text_clean"
    ],
    "emits": [
      "ticket.updated"
    ],
    "input": {
      "type": "object",
      "description": "Add an acceptance criterion.",
      "properties": {
        "text": {
          "type": "string",
          "description": "the criterion",
          "x-metavar": "TEXT"
        },
        "ref": {
          "type": "string",
          "description": "ticket REF (flag)",
          "pattern": "^(?:(?:[A-Z][A-Z0-9]{0,15}-)?[0-9]+(?:/T[1-9][0-9]*)?|T[1-9][0-9]*)$",
          "x-metavar": "REF"
        }
      },
      "x-positional": [
        "text"
      ],
      "required": [
        "text"
      ],
      "additionalProperties": false
    },
    "output": {
      "text": "ok {key} ticket.updated {ac} seq={seq}\nnext: {next}",
      "json": {
        "type": "object",
        "properties": {
          "ac": {
            "type": "string"
          }
        },
        "required": [
          "ac"
        ],
        "additionalProperties": false
      }
    },
    "errors": [
      {
        "code": "ambiguous_ref",
        "exit": 2,
        "retryable": false,
        "hint": "name the ticket REF, for example DEMO-0043",
        "fix": [
          "orch",
          "status"
        ]
      },
      {
        "code": "not_found",
        "exit": 2,
        "retryable": false,
        "hint": "orch list",
        "fix": [
          "orch",
          "list"
        ]
      },
      {
        "code": "grant.expired",
        "exit": 3,
        "retryable": false,
        "hint": "ask the person for a new grant",
        "fix": [
          "orch",
          "status"
        ]
      },
      {
        "code": "grant.required",
        "exit": 3,
        "retryable": false,
        "hint": "ask the person to run orch grant, then set ORCH_GRANT",
        "fix": [
          "orch",
          "status"
        ]
      },
      {
        "code": "transition.refused",
        "exit": 3,
        "retryable": false,
        "hint": "orch show --section current_state",
        "fix": [
          "orch",
          "show"
        ]
      },
      {
        "code": "lock.busy",
        "exit": 4,
        "retryable": true,
        "hint": "retry in a moment",
        "fix": [
          "orch",
          "status"
        ]
      },
      {
        "code": "parse.text",
        "exit": 6,
        "retryable": false,
        "hint": "orch describe ac.add",
        "fix": [
          "orch",
          "describe",
          "ac.add"
        ]
      },
      {
        "code": "conflict.field",
        "exit": 8,
        "retryable": true,
        "hint": "orch show, then redo the edit",
        "fix": [
          "orch",
          "show"
        ]
      }
    ]
  },
  "key": null,
  "seq": 0,
  "cursor": 0,
  "hints": []
}
